[
    {
        "en": "Su Yang",
        "cn": "苏阳",
        "pinyin": "Sū Yáng",
        "type": "Person",
        "gender": "Male",
        "file": 1
    },
    {
        "en": "Wang Yiyi",
        "cn": "王依依",
        "pinyin": "Wáng Yīyī",
        "type": "Person",
        "gender": "Female",
        "file": 1
    },
    {
        "en": "Wang Lang",
        "cn": "王朗",
        "pinyin": "Wáng Lǎng",
        "type": "Person",
        "gender": "Male",
        "file": 1
    },
    {
        "en": "Nine Revolutions Star Scripture",
        "cn": "九转星辰诀",
        "pinyin": "Jiǔzhuǎn Xīngchén Jué",
        "type": "Technique/Art/Method/Incantation/Spell",
        "gender": null,
        "file": 1
    },
    {
        "en": "Eastern Xuan Continent",
        "cn": "东玄大陆",
        "pinyin": "Dōng Xuán Dàlù",
        "type": "Place",
        "gender": null,
        "file": 1
    },
    {
        "en": "Yebei City",
        "cn": "叶北城",
        "pinyin": "Yè Běi Chéng",
        "type": "Place",
        "gender": null,
        "file": 1
    },
    {
        "en": "Demonic Beast Mountain Range",
        "cn": "妖兽山脉",
        "pinyin": "Yāoshòu Shānmài",
        "type": "Place",
        "gender": null,
        "file": 1
    },
    {
        "en": "City Lord's Manor",
        "cn": "城主府",
        "pinyin": "Chéngzhǔ Fǔ",
        "type": "Place",
        "gender": null,
        "file": 1
    },
    {
        "en": "Su Family",
        "cn": "苏家",
        "pinyin": "Sū Jiā",
        "type": "Group",
        "gender": null,
        "file": 1
    },
    {
        "en": "Wang Family",
        "cn": "王家",
        "pinyin": "Wáng Jiā",
        "type": "Group",
        "gender": null,
        "file": 1
    },
    {
        "en": "Spirit Transformation Realm",
        "cn": "化灵境",
        "pinyin": "Huà Líng Jìng",
        "type": "Concept/Term",
        "gender": null,
        "file": 1
    },
    {
        "en": "True Martial Realm",
        "cn": "真武境",
        "pinyin": "Zhēn Wǔ Jìng",
        "type": "Concept/Term",
        "gender": null,
        "file": 1
    },
    {
        "en": "Tri-Profound Realm",
        "cn": "三玄境",
        "pinyin": "Sān Xuán Jìng",
        "type": "Concept/Term",
        "gender": null,
        "file": 1
    },
    {
        "en": "Divine Martial Realm",
        "cn": "神武境",
        "pinyin": "Shén Wǔ Jìng",
        "type": "Concept/Term",
        "gender": null,
        "file": 1
    },
    {
        "en": "Perfection",
        "cn": "圆满",
        "pinyin": "Yuánmǎn",
        "type": "Concept/Term",
        "gender": null,
        "file": 1
    },
    {
        "en": "Supreme Bloodline",
        "cn": "至尊血脉",
        "pinyin": "Zhìzūn Xuèmài",
        "type": "Concept/Term",
        "gender": null,
        "file": 1
    },
    {
        "en": "Fire Phoenix Bloodline",
        "cn": "火凤血脉",
        "pinyin": "Huǒ Fèng Xuèmài",
        "type": "Concept/Term",
        "gender": null,
        "file": 1
    },
    {
        "en": "Supreme Fire Phoenix Bloodline",
        "cn": "至尊火凤血脉",
        "pinyin": "Zhìzūn Huǒ Fèng Xuèmài",
        "type": "Concept/Term",
        "gender": null,
        "file": 1
    },
    {
        "en": "blood slave",
        "cn": "血奴",
        "pinyin": "Xuè Nú",
        "type": "Concept/Term",
        "gender": null,
        "file": 1
    },
    {
        "en": "Grand Elder",
        "cn": "大长老",
        "pinyin": "Dà Zhǎnglǎo",
        "type": "Concept/Term",
        "gender": null,
        "file": 1
    },
    {
        "en": "dantian",
        "cn": "丹田",
        "pinyin": "dāntián",
        "type": "Concept/Term",
        "gender": null,
        "file": 1
    },
    {
        "en": "meridians",
        "cn": "经脉",
        "pinyin": "jīngmài",
        "type": "Concept/Term",
        "gender": null,
        "file": 1
    },
    {
        "en": "eight extraordinary meridians",
        "cn": "奇经八脉",
        "pinyin": "Qí Jīng Bā Mài",
        "type": "Concept/Term",
        "gender": null,
        "file": 1
    },
    {
        "en": "spiritual energy",
        "cn": "灵气",
        "pinyin": "língqì",
        "type": "Concept/Term",
        "gender": null,
        "file": 1
    },
    {
        "en": "cultivation",
        "cn": "修炼",
        "pinyin": "xiūliàn",
        "type": "Concept/Term",
        "gender": null,
        "file": 1
    },
    {
        "en": "cultivation base",
        "cn": "修为",
        "pinyin": "xiūwéi",
        "type": "Concept/Term",
        "gender": null,
        "file": 1
    },
    {
        "en": "expert",
        "cn": "高手",
        "pinyin": "gāoshǒu",
        "type": "Concept/Term",
        "gender": null,
        "file": 1
    },
    {
        "en": "young master",
        "cn": "少主",
        "pinyin": "shàozhǔ",
        "type": "Concept/Term",
        "gender": null,
        "file": 1
    },
    {
        "en": "Soul-Suppressing Iron Chains",
        "cn": "镇魂铁锁",
        "pinyin": "Zhènhún Tiěsuǒ",
        "type": "Item",
        "gender": null,
        "file": 1
    },
    {
        "en": "jade vial",
        "cn": "玉瓶",
        "pinyin": "Yù Píng",
        "type": "Item",
        "gender": null,
        "file": 1
    },
    {
        "en": "Zhang Kuang",
        "cn": "张狂",
        "pinyin": "Zhāng Kuáng",
        "type": "Person",
        "gender": "Male",
        "file": 2
    },
    {
        "en": "Steward Li",
        "cn": "李管事",
        "pinyin": "Lǐ Guǎnshì",
        "type": "Person",
        "gender": "Male",
        "file": 2
    },
    {
        "en": "Great Sage",
        "cn": "大圣",
        "pinyin": "Dà Shèng",
        "type": "Concept/Term",
        "gender": null,
        "file": 2
    },
    {
        "en": "Wang Manor",
        "cn": "王府",
        "pinyin": "Wáng Fǔ",
        "type": "Place",
        "gender": null,
        "file": 3
    },
    {
        "en": "Su Manor",
        "cn": "苏府",
        "pinyin": "Sū Fǔ",
        "type": "Place",
        "gender": null,
        "file": 2
    },
    {
        "en": "Battle Sage Art",
        "cn": "斗战圣法",
        "pinyin": "Dòu Zhàn Shèng Fǎ",
        "type": "Technique/Art/Method/Incantation/Spell",
        "gender": null,
        "file": 4
    },
    {
        "en": "divine sense",
        "cn": "神识",
        "pinyin": "shénshí",
        "type": "Concept/Term",
        "gender": null,
        "file": 4
    },
    {
        "en": "Su Beilou",
        "cn": "苏北楼",
        "pinyin": "Sū Běi Lóu",
        "type": "Person",
        "gender": "Male",
        "file": 5
    },
    {
        "en": "Li Beiye",
        "cn": "李北叶",
        "pinyin": "Lǐ Běi Yè",
        "type": "Person",
        "gender": "Male",
        "file": 5
    },
    {
        "en": "Third Prince",
        "cn": "三皇子",
        "pinyin": "Sān Huángzǐ",
        "type": "Person",
        "gender": "Male",
        "file": 5
    },
    {
        "en": "Great Xia Dynasty",
        "cn": "大夏皇朝",
        "pinyin": "Dà Xià Huáng Cháo",
        "type": "Group",
        "gender": null,
        "file": 5
    },
    {
        "en": "Moongaze Sect",
        "cn": "望月宗",
        "pinyin": "Wàng Yuè Zōng",
        "type": "Group",
        "gender": null,
        "file": 5
    },
    {
        "en": "Lightning Leopard",
        "cn": "闪电豹",
        "pinyin": "Shǎndiàn Bào",
        "type": "Creature",
        "gender": null,
        "file": 6
    },
    {
        "en": "Tri-Profound Power",
        "cn": "三玄之力",
        "pinyin": "Sān Xuán Zhī Lì",
        "type": "Concept/Term",
        "gender": null,
        "file": 7
    },
    {
        "en": "Blazing Fire Fist",
        "cn": "烈火拳",
        "pinyin": "Liè Huǒ Quán",
        "type": "Technique/Art/Method/Incantation/Spell",
        "gender": null,
        "file": 7
    },
    {
        "en": "Wild Bull Force",
        "cn": "莽牛劲",
        "pinyin": "Mǎng Niú Jìn",
        "type": "Technique/Art/Method/Incantation/Spell",
        "gender": null,
        "file": 7
    },
    {
        "en": "Wind God Kick",
        "cn": "风神腿",
        "pinyin": "Fēng Shén Tuǐ",
        "type": "Technique/Art/Method/Incantation/Spell",
        "gender": null,
        "file": 7
    },
    {
        "en": "Purple Lightning Mad Lion",
        "cn": "紫电狂狮",
        "pinyin": "Zǐ Diàn Kuáng Shī",
        "type": "Creature",
        "gender": null,
        "file": 8
    },
    {
        "en": "Purple Lightning Laser Cannon",
        "cn": "紫电镭射炮",
        "pinyin": "Zǐ Diàn Léi Shè Pào",
        "type": "Technique/Art/Method/Incantation/Spell",
        "gender": null,
        "file": 9
    },
    {
        "en": "Soul Contract",
        "cn": "灵魂契约",
        "pinyin": "Líng Hún Qì Yuē",
        "type": "Concept/Term",
        "gender": null,
        "file": 11
    },
    {
        "en": "essence blood",
        "cn": "精血",
        "pinyin": "jīng xuè",
        "type": "Concept/Term",
        "gender": null,
        "file": 11
    },
    {
        "en": "Elder Bi",
        "cn": "毕长老",
        "pinyin": "Bì Zhǎnglǎo",
        "type": "Person",
        "gender": "Male",
        "file": 12
    },
    {
        "en": "Steward Dao",
        "cn": "刀总管",
        "pinyin": "Dāo Zǒngguǎn",
        "type": "Person",
        "gender": "Male",
        "file": 12
    },
    {
        "en": "Tri-Profound qi",
        "cn": "三玄之气",
        "pinyin": "Sān Xuán Zhī Qì",
        "type": "Concept/Term",
        "gender": null,
        "file": 14
    },
    {
        "en": "Poison Butterfly Spirit Crystal Lizard",
        "cn": "毒蝶灵晶蜴",
        "pinyin": "Dú Dié Líng Jīng Yì",
        "type": "Creature",
        "gender": null,
        "file": 14
    },
    {
        "en": "monster",
        "cn": "妖孽",
        "pinyin": "yāo niè",
        "type": "Concept/Term",
        "gender": null,
        "file": 14
    },
    {
        "en": "Su Shaofeng",
        "cn": "苏少锋",
        "pinyin": "Sū Shàofēng",
        "type": "Person",
        "gender": "Male",
        "file": 15
    },
    {